cluster,authors,year,title,venue,doi_or_url,access_tag,ip_use_tag,relevance_one_liner
12-Software,ModuleWorks,(commercial),DED toolpath component,(commercial),https://www.moduleworks.com/software-components/toolpath/additive/direct-energy-deposition/,Industry,Reference-only,Commercial CAM library backend for hybrid systems
12-Software,Kuipers (Ultimaker/Prusa),2022,Arachne perimeter generator,(Prusa docs),https://help.prusa3d.com/article/arachne-perimeter-generator_352769,Code-OSS,Reference-only,Variable-width perimeter generator (3-axis precedent for adaptive line width)
12-Software,(CNC Kitchen),2022,Non-Planar 3D Printing by Bending G-Code,(blog + GitHub),https://www.cnckitchen.com/blog/non-planar-3d-printing-by-bending-g-code,Code-OSS,Reference-only,Maker-grade post-processing of planar G-code to non-planar
13-Patents,(Anonymous),2013,US20130189435A1 - Three-Dimensional Printing System Using Dual Rotation Axes,Google Patents,https://patents.google.com/patent/US20130189435A1/en,Patent,Patent-active-verify,Hardware patent on dual-rotation-axis 3D printer with turntable
13-Patents,(Anonymous),(varied),EP3117982A1 - 3D Printing System and Process,Google Patents,https://patents.google.com/patent/EP3117982A1/en,Patent,Patent-active-verify,Variable-width nozzle with continuous orientation adjustment
13-Patents,(Anonymous),2016,CN106273450A - Multi-axis multi-jet 3D printer,Google Patents,https://patents.google.com/patent/CN106273450A/en,Patent,Patent-active-verify,Chinese patent on multi-axis printer hardware
13-Patents,(Anonymous),2023,US11701813B2 - Multi-input print heads and multi-axis systems,Google Patents,https://patents.google.com/patent/US11701813B2/en,Patent,Patent-active,Multi-axis control over print-head/substrate translation/rotation
13-Patents,(Anonymous),(varied),US7291002B2 - Apparatus and methods for 3D printing,Google Patents,https://patents.google.com/patent/US7291002B2/en,Patent,Patent-active-verify,Continuous radial printing about a rotating build table (likely expired)
14-Industry,Aibuild,(ongoing),Industry leader in software for large-scale & multi-axis robotic AM,(corporate),https://ai-build.com/,Industry,Reference-only,Funder of S^3-Slicer (5AXISWORKS)
14-Industry,RAMLAB,(ongoing),WAAM systems integrator,(corporate),https://www.ramlab.com/resources/waam-101/,Industry,Reference-only,WAAM commercial systems
14-Industry,Sciaky,(ongoing),EBAM electron-beam DED pioneer,(corporate),https://www.sciaky.com/additive-manufacturing/what-is-ded-3d-printing,Industry,Reference-only,Industry pioneer in electron-beam DED
14-Industry,Phasio,2025,5 Axis Toolpath Optimisation,(industry blog),https://www.phas.io/post/5-axis-toolpath-optimisation,Industry,Reference-only,Industry overview blog
14-Industry,Generative Machine + Aibuild,2025-2026,AI-driven 5 axis desktop 3D printing collaboration,(corporate),https://ai-build.com/resources/ai-driven-5-axis-desktop-3d-printing/,Industry,Reference-only,Recent industry collaboration on 5-axis desktop systems
15-Theses,Balasubramaniam,2001,Automatic 5-axis NC toolpath generation,MIT PhD thesis,http://hdl.handle.net/1721.1/29225,Thesis,Cite-and-paraphrase,Foundational MIT thesis under Sanjay Sarma; machining algorithms transfer
15-Theses,Putta,2010,Automatic tool path generation for multi-axis machining,MIT PhD thesis,,Thesis,Cite-and-paraphrase,Follow-on to Balasubramaniam
15-Theses,Goh,2023,Point cloud processing and toolpath generation for robotic 3D printing,(thesis),,Thesis,Cite-and-paraphrase,Recent thesis on point-cloud-based toolpath generation
15-Theses,Xinyi Xiao,(recent),PhD work on automated 5-axis support-free AM process planning,Penn State,https://www.3dnatives.com/en/five-axis-additive-manufacturing-140120215/,Thesis,Cite-and-paraphrase,Penn State group's 5-axis AM process planning
15-Theses,(Harvard GSD MaP+S),2017,Brick Geometries: 5-Axis AM for Architecture,Harvard GSD,https://research.gsd.harvard.edu/maps/2017/03/24/brick-geometries-5-axis-additive-manufacturing-for-architecture/,Thesis,Cite-and-paraphrase,Architectural-design lineage of 5-axis AM
16-Adjacent,Mrazek (blog),2023,Multi-planar Slicing for 3D Printers,(blog),https://blog.honzamrazek.cz/2023/01/multi-planar-slicing-for-3d-printers-for-both-fdm-and-resin/,Industry,Reference-only,Conceptually clear walkthrough of multi-planar slicing for FDM and resin
16-Adjacent,Hackaday,2022,A Universal Non-planar Slicer For 3D Printing Is Worth Thinking About,(blog),https://hackaday.com/2022/04/23/a-universal-non-planar-slicer-for-3d-printing-is-worth-thinking-about/,Industry,Reference-only,Community discussion of non-planar slicing
16-Adjacent,Shahid,2024,Modeling of non-planar slicer for improved surface quality in MEX,arXiv 2411.07225,,Preprint,Cite-and-paraphrase,Combined planar+non-planar slicing for complex objects
16-Adjacent,(Authors),2025,Robotic FDM for free-form fabrication: adaptive non-planar slicing,Rapid Prototyping Journal,https://doi.org/10.1108/RPJ-03-2024-0109,Paywalled,Reference-only,Iso-geodesic slicing for branching geometries on robotic FDM cell
16-Adjacent,(Authors),2023,Global continuous path planning for 3D concrete printing multi-branched structure,Additive Manufacturing,https://www.sciencedirect.com/science/article/abs/pii/S221486042300194X,Paywalled,Reference-only,Adaptive global path planning for branching concrete structures
16-Adjacent,(Authors),2024,A TSP-based continuous path planning for additive manufacturing of concrete,Progress in AM,https://link.springer.com/article/10.1007/s40964-024-00746-2,Paywalled,Reference-only,TSP-based continuous path generation
16-Adjacent,(Authors),2023,Space-filling and print path generation methods for large-area 3DCP,Architectural Intelligence,https://link.springer.com/article/10.1007/s44223-023-00032-1,OA,Cite-and-paraphrase,Pavement-scale concrete printing path generation
16-Adjacent,(Authors),2025,Non-planar additive manufacturing with hydrogels: review of flow control and toolpath strategies,npj Soft Matter,https://www.nature.com/articles/s44431-025-00006-5,OA,Cite-and-paraphrase,OA review including toolpath strategies for non-planar hydrogel printing
16-Adjacent,(Authors),2025,High-Precision Multi-Axis Robotic Bioprinting,Bioengineering 12(9):949,https://www.mdpi.com/2306-5354/12/9/949,OA,Cite-and-paraphrase,Multi-axis robotic bioprinting with conformal paths
16-Adjacent,Wulle et al.,2022,Multi-axis 3D printing of gelatin methacryloyl hydrogels on non-planar surface from MRI,Additive Manufacturing 50:102566,,Paywalled,Reference-only,Patient-specific conformal multi-axis printing
16-Adjacent,(Authors),2019,Conformal additive manufacturing using a direct-print process,Additive Manufacturing,https://www.sciencedirect.com/science/article/abs/pii/S2214860419308048,Paywalled,Reference-only,Conformal printing on freeform substrates
16-Adjacent,(Authors),2022,A dynamic slicing algorithm for conformal additive manufacturing,Additive Manufacturing,https://www.sciencedirect.com/science/article/abs/pii/S2214860422000306,Paywalled,Reference-only,Optimal slicing plane perpendicular to model at each layer
